{
  "schema_version": "0.1",
  "catalog": "check_rules",
  "status": "draft",
  "rules": [
    {
      "rule_id": "argument.format",
      "category": "arguments",
      "default_severity": "error",
      "title": "Argument format",
      "description": "A command argument must match the expected naming format.",
      "agent_guidance": "Check the command usage and retry with the expected identifier format."
    },
    {
      "rule_id": "artifact.directory_exists",
      "category": "artifact",
      "default_severity": "error",
      "title": "Required directory exists",
      "description": "A required repository directory must exist.",
      "agent_guidance": "Create the missing directory or update the standard if the directory is no longer required."
    },
    {
      "rule_id": "artifact.file_exists",
      "category": "artifact",
      "default_severity": "error",
      "title": "Required file exists",
      "description": "A required repository file must exist.",
      "agent_guidance": "Create the missing file, restore it, or update the standard if the file is no longer required."
    },
    {
      "rule_id": "artifact.required",
      "category": "artifact",
      "default_severity": "error",
      "title": "Required artifact or field",
      "description": "A required artifact, section, or field is missing.",
      "agent_guidance": "Inspect the referenced artifact and add the missing required structure."
    },
    {
      "rule_id": "artifact.text_includes",
      "category": "artifact",
      "default_severity": "error",
      "title": "Required text reference",
      "description": "A text artifact must include a required reference.",
      "agent_guidance": "Update the referenced artifact so it includes the required standard pointer."
    },
    {
      "rule_id": "schema.json_parse",
      "category": "schema",
      "default_severity": "error",
      "title": "JSON parses",
      "description": "A JSON schema or output file must parse as JSON.",
      "agent_guidance": "Fix JSON syntax before making semantic changes."
    },
    {
      "rule_id": "schema.declares_schema_uri",
      "category": "schema",
      "default_severity": "error",
      "title": "Schema URI declared",
      "description": "A JSON Schema file must declare `$schema`.",
      "agent_guidance": "Add the JSON Schema draft URI to the schema file."
    },
    {
      "rule_id": "schema.declares_id",
      "category": "schema",
      "default_severity": "error",
      "title": "Schema ID declared",
      "description": "A JSON Schema file must declare `$id`.",
      "agent_guidance": "Add a stable schema ID to the schema file."
    },
    {
      "rule_id": "schema.title",
      "category": "schema",
      "default_severity": "error",
      "title": "Schema title",
      "description": "A JSON Schema file must declare the expected title.",
      "agent_guidance": "Update the schema title or the check expectation so they match intentionally."
    },
    {
      "rule_id": "artifact.declares_field",
      "category": "artifact",
      "default_severity": "error",
      "title": "Required field declared",
      "description": "A manifest, spec, or schema must declare a required field.",
      "agent_guidance": "Add the missing field with a valid value according to the relevant standard."
    },
    {
      "rule_id": "artifact.contains_field",
      "category": "artifact",
      "default_severity": "error",
      "title": "Required field group exists",
      "description": "A manifest or spec must contain a required field group.",
      "agent_guidance": "Add the missing group and keep its structure aligned with the source standard."
    },
    {
      "rule_id": "artifact.minimum_count",
      "category": "artifact",
      "default_severity": "error",
      "title": "Minimum artifact count",
      "description": "A repository artifact collection must contain at least the expected number of items.",
      "agent_guidance": "Create the missing artifact or update the standard if the collection is no longer required."
    },
    {
      "rule_id": "markdown.section",
      "category": "documentation",
      "default_severity": "error",
      "title": "Required Markdown section",
      "description": "A Markdown document must include a required section.",
      "agent_guidance": "Add the missing section and preserve the expected heading text."
    },
    {
      "rule_id": "markdown.heading",
      "category": "documentation",
      "default_severity": "error",
      "title": "Required Markdown heading",
      "description": "A Markdown document must include the expected top-level heading.",
      "agent_guidance": "Update the document heading so it matches the standard for that artifact type."
    },
    {
      "rule_id": "markdown.metadata",
      "category": "documentation",
      "default_severity": "error",
      "title": "Required Markdown metadata",
      "description": "A Markdown document must include required metadata fields.",
      "agent_guidance": "Add the missing metadata field near the top of the document."
    },
    {
      "rule_id": "markdown.unique_id",
      "category": "documentation",
      "default_severity": "error",
      "title": "Unique Markdown identifier",
      "description": "A numbered Markdown record such as an ADR must use a repository-unique identifier.",
      "agent_guidance": "Rename the duplicate record to the next available identifier and update its heading and references."
    },
    {
      "rule_id": "module.registry_match",
      "category": "module",
      "default_severity": "error",
      "title": "Module registry match",
      "description": "A module manifest must match the module registry entry.",
      "agent_guidance": "Align `.arch/modules.yaml` and `modules/<module>/module.yaml`."
    },
    {
      "rule_id": "contract.registry_declared",
      "category": "contract",
      "default_severity": "error",
      "title": "Contract registry declared",
      "description": "The contract registry must exist and declare the expected source format and decision.",
      "agent_guidance": "Inspect `.arch/contracts.yaml` and align it with the contract source format decision."
    },
    {
      "rule_id": "contract.registry_entry",
      "category": "contract",
      "default_severity": "error",
      "title": "Contract registry entry",
      "description": "A registered module contract entry must declare an id and source path in the expected location.",
      "agent_guidance": "Update `.arch/contracts.yaml` so each command, query, event, error catalog, and permission catalog has a valid entry."
    },
    {
      "rule_id": "contract.boundary_only",
      "category": "contract",
      "default_severity": "info",
      "title": "Boundary-only contract module",
      "description": "A registered module may intentionally have no public command, query, event, error, or permission contracts while it is only an ownership boundary.",
      "agent_guidance": "Do not invent contracts just to satisfy checks. Ratify the public API first, then add contract source files and registry entries."
    },
    {
      "rule_id": "contract.source_exists",
      "category": "contract",
      "default_severity": "error",
      "title": "Contract source exists",
      "description": "A registered contract source file must exist.",
      "agent_guidance": "Create the missing contract source file or update the registry path."
    },
    {
      "rule_id": "contract.source_field",
      "category": "contract",
      "default_severity": "error",
      "title": "Contract source field",
      "description": "A contract source file must declare required fields such as schema_version and status.",
      "agent_guidance": "Open the contract source file and add the missing required field."
    },
    {
      "rule_id": "contract.source_match",
      "category": "contract",
      "default_severity": "error",
      "title": "Contract source match",
      "description": "A contract source file must match the registry and module manifest declarations.",
      "agent_guidance": "Align the contract source, `.arch/contracts.yaml`, and `modules/<module>/module.yaml`."
    },
    {
      "rule_id": "protocol.source_root",
      "category": "protocol",
      "default_severity": "error",
      "title": "Protocol source root",
      "description": "The Protobuf source root and expected module-level source paths must exist when required by the protocol alignment status.",
      "agent_guidance": "Inspect `proto/`, `.arch/contracts.yaml`, and `.arch/runtime.yaml`; create the expected source directory or make the alignment status explicit before adding Protobuf files."
    },
    {
      "rule_id": "protocol.framework_manifest",
      "category": "protocol",
      "default_severity": "error",
      "title": "Protocol framework manifest",
      "description": "The game protocol framework manifest must exist and declare the accepted WebSocket Protobuf envelope, routing, session, target, authority, and compatibility model.",
      "agent_guidance": "Inspect `.arch/protocol.yaml`, `docs/game-protocol.md`, and ADR-0015 before adding or changing protocol files."
    },
    {
      "rule_id": "protocol.planned_missing",
      "category": "protocol",
      "default_severity": "info",
      "title": "Planned missing Protobuf source",
      "description": "A registered contract has a planned Protobuf source or message, but missing `.proto` files are still allowed by the current alignment status.",
      "agent_guidance": "Treat this as a planning signal. Before creating `.proto` files, run `node tools/vibit check protocol` and keep the new source aligned with the reported expected path and messages."
    },
    {
      "rule_id": "protocol.package",
      "category": "protocol",
      "default_severity": "error",
      "title": "Protocol package",